{
  "judge": "claims",
  "version": 1,
  "claims": [
    {
      "quote": "تیم فروش شرکت نمونه‌ی آلفا پیش‌نویس پاسخ به سرنخ‌ها را دستی بازبینی می‌کند و مدیر فروش در جلسه‌ی کشف گفت این بازبینی گلوگاه پاسخ‌گویی است [C-01].",
      "section": "S02",
      "ledger_ref": "C-01",
      "status": "supported",
      "note": ""
    },
    {
      "quote": "طبق صورت‌جلسه‌ی کشف نیاز در ۱۴۰۵/۰۶/۳۰، هر پیش‌نویس پاسخ پیش از ارسال توسط یک کارشناس فروش بازبینی می‌شود [C-02].",
      "section": "S03",
      "ledger_ref": "C-02",
      "status": "supported",
      "note": ""
    },
    {
      "quote": "این روش انتخاب شد چون مسئله‌ی گزارش‌شده بازبینی است، نه نوشتن [C-01].",
      "section": "S05",
      "ledger_ref": "C-01",
      "status": "supported",
      "note": "منبع فقط گلوگاه بودن بازبینی را می‌گوید؛ «نه نوشتن» استنتاج تهیه‌کننده است، ولی با گفته‌ی مدیر فروش نمی‌خواند نمی‌شود."
    },
    {
      "quote": "نمونه‌ی قابل بررسی در جلسه‌ی کشف نمایش داده شد [C-03].",
      "section": "S14",
      "ledger_ref": "C-03",
      "status": "supported",
      "note": ""
    }
  ],
  "summary": {
    "supported": 4,
    "labeled_assumption": 0,
    "unsupported": 0,
    "contradicts_ledger": 0
  },
  "bottom_line": "ادعای بی‌منبع یا ناسازگار با دفتر پیدا نشد؛ هر چهار ادعای واقعی سند به discovery_notes پر و هم‌خوان وصل است، فقط «نه نوشتن» در S05 استنتاج است."
}
