{
  "judge": "claims",
  "version": 1,
  "claims": [
    {
      "quote": "مدیر فروش در جلسه‌ی کشف گفت این بازبینی گلوگاه پاسخ‌گویی است",
      "section": "S02",
      "ledger_ref": "C-01",
      "status": "supported",
      "note": ""
    },
    {
      "quote": "هر پیش‌نویس پاسخ پیش از ارسال توسط یک کارشناس فروش بازبینی می‌شود",
      "section": "S03",
      "ledger_ref": "C-02",
      "status": "supported",
      "note": "تاریخ ۱۴۰۵/۰۶/۳۰ با ورودی و دفتر یکی است."
    },
    {
      "quote": "این روش انتخاب شد چون مسئله‌ی گزارش‌شده بازبینی است، نه نوشتن",
      "section": "S05",
      "ledger_ref": "C-01",
      "status": "supported",
      "note": "بخش «بازبینی گلوگاه است» در ورودی هست؛ «نه نوشتن» استنتاج نویسنده است و در ورودی نیامده، اما ادعای واقعیت جدا نیست."
    },
    {
      "quote": "برآورد با فرض دسترسی آزمایشی به صندوق ایمیل فروش تا روز کاری ۵ است",
      "section": "S10",
      "ledger_ref": null,
      "status": "labeled_assumption",
      "note": "صریحاً فرض نامیده شده است."
    },
    {
      "quote": "فرض: مقدار پس از اندازه‌گیری خط مبنا در فاز کشف برآورد می‌شود",
      "section": "S09",
      "ledger_ref": null,
      "status": "labeled_assumption",
      "note": "مقدار CB-01 نامعلوم و برچسب فرض دارد؛ عدد ساخته نشده است."
    },
    {
      "quote": "نمونه‌ی قابل بررسی در جلسه‌ی کشف نمایش داده شد",
      "section": "S14",
      "ledger_ref": "C-03",
      "status": "supported",
      "note": ""
    }
  ],
  "summary": {
    "supported": 4,
    "labeled_assumption": 2,
    "unsupported": 0,
    "contradicts_ledger": 0
  },
  "bottom_line": "ادعای بی‌منبع یا مغایر با دفتر پیدا نشد؛ ضعیف‌ترین مورد استنتاج «نه نوشتن» در S05 است که فقط از گلوگاه‌بودن بازبینی برداشت شده و در یادداشت‌ها نیامده."
}
